{
  "schemaVersion": "1.0.0",
  "completedAt": "2026-09-15T17:33:42.499Z",
  "status": "applied",
  "action": "update",
  "targetPath": ".github/agents/visual-storytelling-director.agent.md",
  "blueprintSha256": "9aa28e0989ec4a910a1670174dd71850293d59b63d43bfed9a7ee53b5bdde943",
  "renderedSha256": "1124bd0940483c7bf6b2b508ffa6c2a58044400fc5b1cb2f84803e671226e231",
  "transactionId": "AGT-d35e1ce1-a143-4361-842f-8a18c7b22761"
}
